{
  "contractVersion": "sdar.domain-projection/v1",
  "projectionId": "fixture.projection.alpha",
  "projectionVersion": 1,
  "source": {
    "database": "sdar_commander",
    "table": "fixture_source_fact",
    "schemaName": "fixture.source/v1",
    "schemaVersion": 1
  },
  "target": {
    "database": "sdar_embodied",
    "table": "control_action",
    "schemaName": "fixture.target/v1",
    "schemaVersion": 1
  },
  "mapperId": "fixture.mapper.alpha",
  "mapperVersion": "1.0.0",
  "cursorPolicy": {
    "fields": ["occurred_at", "record_id", "record_revision"],
    "uniqueTieBreakerFields": ["record_id", "record_revision"],
    "order": "asc"
  },
  "identityPolicy": {
    "version": "sha256-v1"
  },
  "enabled": true
}
